{
  "schemaVersion": 1,
  "kind": "case",
  "id": "detector-coverage-linear-token-twin-length",
  "title": "Linear Personal API key: one-property twin (length)",
  "summary": "3 inputs are identical to a positive input except for one change: the value's length differs from the contracted length. Legacy mutation notes: length: 47 vs contracted 48. Twin of \"Linear Personal API key: must be flagged\".",
  "rationale": "A twin changes exactly one property, so the expected outcome differs from the positive for that one reason. Reporting the twin is a false alarm, and it shows that the changed property is part of what identifies the credential.",
  "caseTypes": [
    "twin",
    "mutation",
    "benign"
  ],
  "families": [
    {
      "family": "linear:personal-api-key",
      "role": "lookalike"
    }
  ],
  "scenarios": [
    "benign-controls-and-twins",
    "credential-shape-grammar"
  ],
  "expectation": {
    "outcome": "must-not-flag",
    "basis": "tool-corroborated",
    "rationale": "Negative twin of linear-token-shape-1-bare: length: 47 vs contracted 48. Exactly one structural property differs from the positive; silence follows from construction.",
    "sources": [
      {
        "sourceId": "github-com-gitleaks-gitleaks-e50f42b821",
        "supports": "Cited by the legacy assessment (open-source scanner rule); claim not itemised."
      },
      {
        "sourceId": "github-com-trufflesecurity-trufflehog-17488fa96d",
        "supports": "Cited by the legacy assessment (open-source scanner rule); claim not itemised."
      },
      {
        "sourceId": "linear-app-4474ab72a9",
        "supports": "Cited by the legacy assessment (provider documentation); claim not itemised."
      }
    ],
    "observedAt": "2026-09-29"
  },
  "relations": [
    {
      "type": "twin-of",
      "target": "detector-coverage-linear-token",
      "mutationKind": "length",
      "note": "length: 47 vs contracted 48"
    }
  ],
  "lifecycle": "draft",
  "externalRefs": [
    {
      "system": "legacy-cases-import",
      "id": "ade8a10bd7922765110a68986b0690eb3861f2e5:fixtures/generated/detector-coverage.mjs",
      "url": "https://github.com/redact-secret/redact-secret-benchmarks/blob/ade8a10bd7922765110a68986b0690eb3861f2e5/fixtures/generated/detector-coverage.mjs",
      "note": "suite detector-coverage; group linear-token; 3 fixtures"
    }
  ],
  "notes": "Project-authored by the Redact Secret project, which maintains this repository; not independent evidence. Imported as a draft from the legacy suite \"Detector coverage\" (detector-coverage); not yet reviewed."
}
