{
  "schemaVersion": 1,
  "kind": "case",
  "id": "beta8-207-atlassian-api-token-control-near-miss",
  "title": "Atlassian API token: benign near miss controls",
  "summary": "2 inputs holding near-miss values that resemble the format but break it (truncated, wrong separator, wrong prefix or too short).",
  "rationale": "Incomplete or malformed values are not issued credentials. They test whether the format's structure, and not only its look, is what identifies a credential.",
  "caseTypes": [
    "benign"
  ],
  "families": [
    {
      "family": "atlassian:api-token",
      "role": "lookalike"
    }
  ],
  "scenarios": [
    "benign-controls-and-twins",
    "regression-behavior"
  ],
  "expectation": {
    "outcome": "must-not-flag",
    "basis": "project-policy",
    "rationale": "Legacy tier T2 (tool-corroborated), but the cited sources do not include artifacts from two distinct owners, so the corroboration rule of docs/governance/evidence-classes.md is not met; the legacy expectation is recorded as project-policy pending review. Malformed-by-construction control: prefix-only, truncated, mis-delimited or public-material shape of a contracted family. Expected silence follows from construction.",
    "sources": [
      {
        "sourceId": "github-com-gitleaks-gitleaks-e50f42b821",
        "supports": "Cited by the legacy assessment (open-source scanner rule); claim not itemised."
      }
    ],
    "observedAt": "2026-09-29"
  },
  "lifecycle": "draft",
  "externalRefs": [
    {
      "system": "legacy-cases-import",
      "id": "ade8a10bd7922765110a68986b0690eb3861f2e5:fixtures/generated/beta8/207.mjs",
      "url": "https://github.com/redact-secret/redact-secret-benchmarks/blob/ade8a10bd7922765110a68986b0690eb3861f2e5/fixtures/generated/beta8/207.mjs",
      "note": "suite beta8-207; group #207 · atlassian-api-token; 2 fixtures"
    },
    {
      "system": "redact-secret-benchmarks-issue",
      "id": "redact-secret-benchmarks#207",
      "url": "https://github.com/redact-secret/redact-secret-benchmarks/issues/207",
      "note": "Legacy benchmark issue the suite slice was written for."
    }
  ],
  "notes": "Project-authored by the Redact Secret project, which maintains this repository; not independent evidence. Imported as a draft from the legacy suite \"Beta.8 low-coverage hardening (#207)\" (beta8-207); not yet reviewed."
}
