{
  "schemaVersion": 1,
  "kind": "case",
  "id": "detector-coverage-telegram-bot-token-benign-t3",
  "title": "Telegram Bot token: must not be flagged (project-policy) [legacy tier T3]",
  "summary": "3 inputs related to Telegram Bot token that resemble the format but are not issued credentials (a bare prefix, a short body, a mask or a reference).",
  "rationale": "A value that only resembles a credential is not one. Reporting it is a false alarm, and it shows whether structure and context, not appearance, decide the outcome.",
  "caseTypes": [
    "benign"
  ],
  "families": [
    {
      "family": "telegram:bot-token",
      "role": "lookalike"
    }
  ],
  "scenarios": [
    "benign-controls-and-twins",
    "credential-shape-grammar"
  ],
  "expectation": {
    "outcome": "must-not-flag",
    "basis": "project-policy",
    "rationale": "Placeholder, reference, template, mask, documentation or ordinary text. Expected silence is project policy.",
    "sources": [
      {
        "sourceId": "github-com-trufflesecurity-trufflehog-af9449fb2d",
        "supports": "Cited by the legacy assessment (open-source scanner rule); claim not itemised."
      }
    ],
    "observedAt": "2026-09-22"
  },
  "lifecycle": "draft",
  "externalRefs": [
    {
      "system": "legacy-cases-import",
      "id": "ade8a10bd7922765110a68986b0690eb3861f2e5:fixtures/generated/detector-coverage.mjs",
      "url": "https://github.com/redact-secret/redact-secret-benchmarks/blob/ade8a10bd7922765110a68986b0690eb3861f2e5/fixtures/generated/detector-coverage.mjs",
      "note": "suite detector-coverage; group telegram-bot-token; 3 fixtures"
    }
  ],
  "notes": "Project-authored by the Redact Secret project, which maintains this repository; not independent evidence. Imported as a draft from the legacy suite \"Detector coverage\" (detector-coverage); not yet reviewed."
}
