{
  "schemaVersion": 1,
  "kind": "case",
  "id": "beta8-434b-trigger-dev-personal-access-token-control-placeholder",
  "title": "Trigger.dev Personal access token (tr_pat_): benign placeholder controls",
  "summary": "2 inputs holding documentation placeholders and example values for the credential.",
  "rationale": "Documentation is written to be copied. A placeholder was never issued, so reporting it is noise, and a scanner that stays silent on it must not also stay silent on a real value in the same position.",
  "caseTypes": [
    "benign"
  ],
  "families": [
    {
      "family": "trigger-dev:personal-access-token",
      "role": "lookalike"
    }
  ],
  "scenarios": [
    "benign-controls-and-twins",
    "documentation-placeholder",
    "regression-behavior"
  ],
  "expectation": {
    "outcome": "must-not-flag",
    "basis": "project-policy",
    "rationale": "Placeholder, reference, template, mask, documentation or ordinary text. Expected silence is project policy.",
    "sources": [
      {
        "sourceId": "github-com-redact-secret-redact-secret-600e29e0fd",
        "supports": "Cited by the legacy assessment (project research note); claim not itemised."
      },
      {
        "sourceId": "github-com-redact-secret-redact-secret-ac559a3b98",
        "supports": "Cited by the legacy assessment (provider documentation); claim not itemised.",
        "locator": "#issuecomment-5852413851"
      },
      {
        "sourceId": "github-com-redact-secret-redact-secret-ac559a3b98",
        "supports": "Cited by the legacy assessment (provider documentation); claim not itemised."
      },
      {
        "sourceId": "github-com-redact-secret-redact-secret-benchmarks-fb496527b7",
        "supports": "Cited by the legacy assessment (issue or discussion); claim not itemised."
      },
      {
        "sourceId": "github-com-redact-secret-redact-secret-c53641a717",
        "supports": "Cited by the legacy assessment (issue or discussion); claim not itemised."
      },
      {
        "sourceId": "github-com-redact-secret-redact-secret-dd6d170141",
        "supports": "Cited by the legacy assessment (provider documentation); claim not itemised."
      },
      {
        "sourceId": "github-com-triggerdotdev-trigger-dev-4d7c4605cf",
        "supports": "Cited by the legacy assessment (provider SDK source); claim not itemised."
      },
      {
        "sourceId": "github-com-triggerdotdev-trigger-dev-5f00d304a1",
        "supports": "Cited by the legacy assessment (provider documentation); claim not itemised."
      },
      {
        "sourceId": "github-com-triggerdotdev-trigger-dev-6b48ba1909",
        "supports": "Cited by the legacy assessment (provider documentation); claim not itemised."
      },
      {
        "sourceId": "github-com-triggerdotdev-trigger-dev-ba66faad37",
        "supports": "Cited by the legacy assessment (source); claim not itemised."
      },
      {
        "sourceId": "github-com-triggerdotdev-trigger-dev-bb0de08c72",
        "supports": "Cited by the legacy assessment (provider SDK source); claim not itemised."
      },
      {
        "sourceId": "trigger-dev-81c493edb9",
        "supports": "Cited by the legacy assessment (provider documentation); claim not itemised."
      }
    ],
    "observedAt": "2026-09-29"
  },
  "lifecycle": "draft",
  "externalRefs": [
    {
      "system": "legacy-cases-import",
      "id": "ade8a10bd7922765110a68986b0690eb3861f2e5:fixtures/generated/beta8/434b.mjs",
      "url": "https://github.com/redact-secret/redact-secret-benchmarks/blob/ade8a10bd7922765110a68986b0690eb3861f2e5/fixtures/generated/beta8/434b.mjs",
      "note": "suite beta8-434b; group #434b · trigger-dev-personal-access-token; 2 fixtures"
    },
    {
      "system": "redact-secret-benchmarks-issue",
      "id": "redact-secret-benchmarks#434",
      "url": "https://github.com/redact-secret/redact-secret-benchmarks/issues/434",
      "note": "Legacy benchmark issue the suite slice was written for."
    }
  ],
  "notes": "Project-authored by the Redact Secret project, which maintains this repository; not independent evidence. Imported as a draft from the legacy suite \"Beta.11 evidence for the Trigger.dev secret key and PAT (#434, slice b)\" (beta8-434b); not yet reviewed."
}
