{
  "schemaVersion": 1,
  "kind": "case",
  "id": "detector-coverage-clojars-deploy-token-benign-t3",
  "title": "Deploy token (CLOJARS_): must not be flagged (project-policy)",
  "summary": "3 inputs related to Deploy token (CLOJARS_) that resemble the format but are not issued credentials (a bare prefix, a short body, a mask or a reference).",
  "rationale": "A value that only resembles a credential is not one. Reporting it is a false alarm, and it shows whether structure and context, not appearance, decide the outcome.",
  "caseTypes": [
    "benign"
  ],
  "families": [
    {
      "family": "clojars:deploy-token",
      "role": "lookalike"
    }
  ],
  "scenarios": [
    "benign-controls-and-twins",
    "credential-shape-grammar"
  ],
  "expectation": {
    "outcome": "must-not-flag",
    "basis": "project-policy",
    "rationale": "Placeholder, reference, template, mask, documentation or ordinary text. Expected silence is project policy.",
    "sources": [
      {
        "sourceId": "github-com-clojars-clojars-web-e4965bbabe",
        "supports": "Cited by the legacy assessment (provider documentation); claim not itemised.",
        "locator": "#L799-L853"
      },
      {
        "sourceId": "github-com-gitleaks-gitleaks-e50f42b821",
        "supports": "Cited by the legacy assessment (open-source scanner rule); claim not itemised."
      },
      {
        "sourceId": "github-com-redact-secret-redact-secret-58f4c6223a",
        "supports": "Cited by the legacy assessment (provider documentation); claim not itemised."
      },
      {
        "sourceId": "github-com-redact-secret-redact-secret-7266f57eea",
        "supports": "Cited by the legacy assessment (issue or discussion); claim not itemised.",
        "locator": "#issuecomment-5900447282"
      },
      {
        "sourceId": "github-com-redact-secret-redact-secret-7266f57eea",
        "supports": "Cited by the legacy assessment (issue or discussion); claim not itemised."
      },
      {
        "sourceId": "github-com-redact-secret-redact-secret-76118ee96e",
        "supports": "Cited by the legacy assessment (provider documentation); claim not itemised."
      },
      {
        "sourceId": "github-com-redact-secret-redact-secret-ac559a3b98",
        "supports": "Cited by the legacy assessment (provider documentation); claim not itemised.",
        "locator": "#issuecomment-5852413851"
      },
      {
        "sourceId": "github-com-redact-secret-redact-secret-benchmarks-aecd1a9677",
        "supports": "Cited by the legacy assessment (issue or discussion); claim not itemised."
      },
      {
        "sourceId": "github-com-redact-secret-redact-secret-f4ef7214ef",
        "supports": "Cited by the legacy assessment (issue or discussion); claim not itemised."
      }
    ],
    "observedAt": "2026-09-29"
  },
  "lifecycle": "draft",
  "externalRefs": [
    {
      "system": "legacy-cases-import",
      "id": "ade8a10bd7922765110a68986b0690eb3861f2e5:fixtures/generated/detector-coverage.mjs",
      "url": "https://github.com/redact-secret/redact-secret-benchmarks/blob/ade8a10bd7922765110a68986b0690eb3861f2e5/fixtures/generated/detector-coverage.mjs",
      "note": "suite detector-coverage; group clojars-deploy-token; 3 fixtures"
    }
  ],
  "notes": "Project-authored by the Redact Secret project, which maintains this repository; not independent evidence. Imported as a draft from the legacy suite \"Detector coverage\" (detector-coverage); not yet reviewed."
}
