{
  "schemaVersion": 1,
  "kind": "case",
  "id": "empty-referenced-and-templated-credential-values",
  "title": "GITHUB_TOKEN with an empty value, a variable reference or a template reference",
  "summary": "GITHUB_TOKEN= with nothing after it, GITHUB_TOKEN=${GITHUB_TOKEN}, github_token: {{ secrets.github_token }} and GITHUB_TOKEN=[REDACTED] in configuration files.",
  "rationale": "The name is the strongest possible credential signal and the value is empty, a reference or redacted. The name alone must not produce a finding.",
  "caseTypes": [
    "benign"
  ],
  "families": [
    {
      "family": "generic:unclassified-assignment-literal",
      "role": "lookalike"
    }
  ],
  "scenarios": [
    "credential-named-assignment-false-positive",
    "documentation-placeholder",
    "templated-reference"
  ],
  "expectation": {
    "outcome": "must-not-flag",
    "basis": "project-policy",
    "rationale": "Not flagged. The value is empty, a reference or an explicit redaction marker, so no secret byte is present.",
    "sources": [],
    "observedAt": "2026-09-29"
  },
  "lifecycle": "draft",
  "externalRefs": [
    {
      "system": "legacy-benchmark-source",
      "id": "ade8a10bd7922765110a68986b0690eb3861f2e5:fixtures/generated/build.mjs#placeholders",
      "url": "https://github.com/redact-secret/redact-secret-benchmarks/blob/ade8a10bd7922765110a68986b0690eb3861f2e5/fixtures/generated/build.mjs",
      "note": "legacy suite negative-controls; group Placeholders; 6 fixtures"
    }
  ],
  "notes": "Project-authored by the Redact Secret project, which maintains this repository; not independent evidence. Reclassified from 1 legacy group (6 fixtures); draft, not yet reviewed."
}
