{
  "schemaVersion": 1,
  "kind": "case",
  "id": "beta8-379-heroku-api-key-legacy-twin-context",
  "title": "Heroku Legacy API key (bare UUID): one-property twin (context)",
  "summary": "3 inputs are identical to a positive input except for one change: the value is unchanged but the carrier lacks the marker that makes the value identifiable. Legacy mutation notes: context:field: the Token row relabelled Client ID; the value is kept byte-for-byte (basis: context), context:host: git.heroku.com replaced by git.example.test; the value is kept byte-for-byte (basis: context), and context:keyword: HEROKU_API_KEY renamed SENTRY_RELEASE_ID; the value is kept byte-for-byte (basis: context). Twin of \"Heroku Legacy API key (bare UUID): must be flagged\".",
  "rationale": "A twin changes exactly one property, so the expected outcome differs from the positive for that one reason. Reporting the twin is a false alarm, and it shows that the changed property is part of what identifies the credential.",
  "caseTypes": [
    "twin",
    "mutation",
    "benign"
  ],
  "families": [
    {
      "family": "heroku:legacy-api-key",
      "role": "lookalike"
    }
  ],
  "scenarios": [
    "benign-controls-and-twins",
    "context-and-encoding"
  ],
  "expectation": {
    "outcome": "must-not-flag",
    "basis": "project-policy",
    "rationale": "Negative twin of heroku-api-key-legacy-authorizations-info: context:field: the Token row relabelled Client ID; the value is kept byte-for-byte (basis: context). The value is unchanged and exactly one property of the assignment context differs; expected silence is project policy, as the positive's expectation is.",
    "sources": [
      {
        "sourceId": "github-com-gitleaks-gitleaks-e50f42b821",
        "supports": "Cited by the legacy assessment (open-source scanner rule); claim not itemised."
      },
      {
        "sourceId": "github-com-trufflesecurity-trufflehog-ec8468ab33",
        "supports": "Cited by the legacy assessment (open-source scanner rule); claim not itemised."
      }
    ],
    "observedAt": "2026-09-29"
  },
  "relations": [
    {
      "type": "twin-of",
      "target": "beta8-379-heroku-api-key-legacy",
      "mutationKind": "context",
      "note": "context:keyword: HEROKU_API_KEY renamed SENTRY_RELEASE_ID; the value is kept byte-for-byte (basis: context)"
    }
  ],
  "lifecycle": "draft",
  "externalRefs": [
    {
      "system": "legacy-cases-import",
      "id": "ade8a10bd7922765110a68986b0690eb3861f2e5:fixtures/generated/beta8/379.mjs",
      "url": "https://github.com/redact-secret/redact-secret-benchmarks/blob/ade8a10bd7922765110a68986b0690eb3861f2e5/fixtures/generated/beta8/379.mjs",
      "note": "suite beta8-379; group #379 · heroku-api-key-legacy; 3 fixtures"
    },
    {
      "system": "redact-secret-benchmarks-issue",
      "id": "redact-secret-benchmarks#379",
      "url": "https://github.com/redact-secret/redact-secret-benchmarks/issues/379",
      "note": "Legacy benchmark issue the suite slice was written for."
    }
  ],
  "notes": "Project-authored by the Redact Secret project, which maintains this repository; not independent evidence. Imported as a draft from the legacy suite \"Beta.11 independent family evidence for fifteen selected credential families (#379)\" (beta8-379); not yet reviewed."
}
