{
  "schemaVersion": 1,
  "kind": "case",
  "id": "beta8-1012b-google-oauth-client-secret-control-placeholder",
  "title": "Google OAuth client secret: benign placeholder controls",
  "summary": "3 inputs holding documentation placeholders and example values for the credential.",
  "rationale": "Documentation is written to be copied. A placeholder was never issued, so reporting it is noise, and a scanner that stays silent on it must not also stay silent on a real value in the same position.",
  "caseTypes": [
    "benign"
  ],
  "families": [
    {
      "family": "google:oauth-client-secret",
      "role": "lookalike"
    }
  ],
  "scenarios": [
    "benign-controls-and-twins",
    "documentation-placeholder",
    "regression-behavior"
  ],
  "expectation": {
    "outcome": "must-not-flag",
    "basis": "project-policy",
    "rationale": "Placeholder, reference, template, mask, documentation or ordinary text. Expected silence is project policy.",
    "sources": [
      {
        "sourceId": "developers-google-com-6dcb5626c6",
        "supports": "Cited by the legacy assessment (provider documentation); claim not itemised."
      },
      {
        "sourceId": "github-com-google-osv-scalibr-929e852d03",
        "supports": "Cited by the legacy assessment (open-source scanner rule); claim not itemised.",
        "locator": "#L51-L58"
      },
      {
        "sourceId": "github-com-googleworkspace-cli-73d65a23b0",
        "supports": "Cited by the legacy assessment (open-source scanner rule); claim not itemised.",
        "locator": "#L26"
      },
      {
        "sourceId": "github-com-praetorian-inc-noseyparker-22b9fd9a79",
        "supports": "Cited by the legacy assessment (open-source scanner rule); claim not itemised.",
        "locator": "#L17-L29"
      },
      {
        "sourceId": "github-com-redact-secret-redact-secret-7867130841",
        "supports": "Cited by the legacy assessment (provider documentation); claim not itemised."
      },
      {
        "sourceId": "github-com-redact-secret-redact-secret-ac559a3b98",
        "supports": "Cited by the legacy assessment (provider documentation); claim not itemised.",
        "locator": "#issuecomment-5871306275"
      },
      {
        "sourceId": "github-com-redact-secret-redact-secret-ae8940925d",
        "supports": "Cited by the legacy assessment (issue or discussion); claim not itemised."
      },
      {
        "sourceId": "github-com-redact-secret-redact-secret-benchmarks-aecd1a9677",
        "supports": "Cited by the legacy assessment (issue or discussion); claim not itemised."
      },
      {
        "sourceId": "github-com-redact-secret-redact-secret-cada3e4955",
        "supports": "Cited by the legacy assessment (issue or discussion); claim not itemised."
      },
      {
        "sourceId": "github-com-redact-secret-redact-secret-f0d1f2054e",
        "supports": "Cited by the legacy assessment (project research note); claim not itemised."
      },
      {
        "sourceId": "github-com-samsung-credsweeper-da6c4ccf00",
        "supports": "Cited by the legacy assessment (open-source scanner rule); claim not itemised.",
        "locator": "#L463-L475"
      },
      {
        "sourceId": "support-google-com-9519da266b",
        "supports": "Cited by the legacy assessment (source); claim not itemised."
      }
    ],
    "observedAt": "2026-09-29"
  },
  "lifecycle": "draft",
  "externalRefs": [
    {
      "system": "legacy-cases-import",
      "id": "ade8a10bd7922765110a68986b0690eb3861f2e5:fixtures/generated/beta8/1012b.mjs",
      "url": "https://github.com/redact-secret/redact-secret-benchmarks/blob/ade8a10bd7922765110a68986b0690eb3861f2e5/fixtures/generated/beta8/1012b.mjs",
      "note": "suite beta8-1012b; group #1012b · google-oauth-client-secret; 3 fixtures"
    },
    {
      "system": "redact-secret-benchmarks-issue",
      "id": "redact-secret-benchmarks#1012",
      "url": "https://github.com/redact-secret/redact-secret-benchmarks/issues/1012",
      "note": "Legacy benchmark issue the suite slice was written for."
    }
  ],
  "notes": "Project-authored by the Redact Secret project, which maintains this repository; not independent evidence. Imported as a draft from the legacy suite \"Beta.12 evidence for the Google OAuth client secret (#528, #1012 slice b)\" (beta8-1012b); not yet reviewed."
}
