{
  "schemaVersion": 1,
  "kind": "case",
  "id": "beta8-207-confluent-cloud-api-secret-legacy-control-placeholder",
  "title": "Confluent Cloud Cloud API secret (unprefixed, pre-2025-07-30): benign placeholder controls (project-policy) [legacy tier T3]",
  "summary": "2 inputs holding documentation placeholders and example values for the credential.",
  "rationale": "Documentation is written to be copied. A placeholder was never issued, so reporting it is noise, and a scanner that stays silent on it must not also stay silent on a real value in the same position.",
  "caseTypes": [
    "benign"
  ],
  "families": [
    {
      "family": "confluent:cloud-api-secret-legacy",
      "role": "lookalike"
    }
  ],
  "scenarios": [
    "benign-controls-and-twins",
    "documentation-placeholder",
    "regression-behavior"
  ],
  "expectation": {
    "outcome": "must-not-flag",
    "basis": "project-policy",
    "rationale": "Placeholder, reference, template, mask, documentation or ordinary text. Expected silence is project policy.",
    "sources": [
      {
        "sourceId": "github-com-gitleaks-gitleaks-e50f42b821",
        "supports": "Cited by the legacy assessment (open-source scanner rule); claim not itemised."
      },
      {
        "sourceId": "github-com-trufflesecurity-trufflehog-4e3adcebf2",
        "supports": "Cited by the legacy assessment (open-source scanner rule); claim not itemised."
      }
    ],
    "observedAt": "2026-09-29"
  },
  "lifecycle": "draft",
  "externalRefs": [
    {
      "system": "legacy-cases-import",
      "id": "ade8a10bd7922765110a68986b0690eb3861f2e5:fixtures/generated/beta8/207.mjs",
      "url": "https://github.com/redact-secret/redact-secret-benchmarks/blob/ade8a10bd7922765110a68986b0690eb3861f2e5/fixtures/generated/beta8/207.mjs",
      "note": "suite beta8-207; group #207 · confluent-cloud-api-secret-legacy; 2 fixtures"
    },
    {
      "system": "redact-secret-benchmarks-issue",
      "id": "redact-secret-benchmarks#207",
      "url": "https://github.com/redact-secret/redact-secret-benchmarks/issues/207",
      "note": "Legacy benchmark issue the suite slice was written for."
    }
  ],
  "notes": "Project-authored by the Redact Secret project, which maintains this repository; not independent evidence. Imported as a draft from the legacy suite \"Beta.8 low-coverage hardening (#207)\" (beta8-207); not yet reviewed."
}
