{
  "schemaVersion": 1,
  "kind": "case",
  "id": "beta8-528a-bitwarden-secrets-manager-access-token-control-public-id",
  "title": "Bitwarden Secrets Manager access token (0. + UUID layout): benign public id controls",
  "summary": "3 inputs holding public identifiers that sit next to the credential and look like it but are not secret.",
  "rationale": "Providers publish identifiers (account, key or client ids) beside their secrets. Reporting one is a false alarm, and redacting it removes information a reader legitimately needs.",
  "caseTypes": [
    "benign"
  ],
  "families": [
    {
      "family": "bitwarden:secrets-manager-access-token",
      "role": "lookalike"
    }
  ],
  "scenarios": [
    "benign-controls-and-twins",
    "cross-family-interactions",
    "regression-behavior"
  ],
  "expectation": {
    "outcome": "must-not-flag",
    "basis": "tool-corroborated",
    "rationale": "Public identifier constructed to contain no credential: silence follows from construction.",
    "sources": [
      {
        "sourceId": "bitwarden-com-b047250b46",
        "supports": "Cited by the legacy assessment (provider documentation); claim not itemised."
      },
      {
        "sourceId": "github-com-bitwarden-sdk-internal-10010bd27f",
        "supports": "Cited by the legacy assessment (provider documentation); claim not itemised.",
        "locator": "#L47-L85"
      },
      {
        "sourceId": "github-com-bitwarden-server-745b4c2eb0",
        "supports": "Cited by the legacy assessment (provider SDK source); claim not itemised.",
        "locator": "#L205-L209"
      },
      {
        "sourceId": "github-com-bitwarden-server-ed20d9ab64",
        "supports": "Cited by the legacy assessment (provider SDK source); claim not itemised.",
        "locator": "#L14-L29"
      },
      {
        "sourceId": "github-com-redact-secret-redact-secret-0842fd98b1",
        "supports": "Cited by the legacy assessment (provider documentation); claim not itemised."
      },
      {
        "sourceId": "github-com-redact-secret-redact-secret-47ea03f9c9",
        "supports": "Cited by the legacy assessment (issue or discussion); claim not itemised."
      },
      {
        "sourceId": "github-com-redact-secret-redact-secret-58f4c6223a",
        "supports": "Cited by the legacy assessment (provider documentation); claim not itemised."
      },
      {
        "sourceId": "github-com-redact-secret-redact-secret-7266f57eea",
        "supports": "Cited by the legacy assessment (issue or discussion); claim not itemised.",
        "locator": "#issuecomment-5900447282"
      },
      {
        "sourceId": "github-com-redact-secret-redact-secret-7266f57eea",
        "supports": "Cited by the legacy assessment (issue or discussion); claim not itemised."
      },
      {
        "sourceId": "github-com-redact-secret-redact-secret-ac559a3b98",
        "supports": "Cited by the legacy assessment (provider documentation); claim not itemised.",
        "locator": "#issuecomment-5852413851"
      },
      {
        "sourceId": "github-com-redact-secret-redact-secret-benchmarks-aecd1a9677",
        "supports": "Cited by the legacy assessment (issue or discussion); claim not itemised."
      }
    ],
    "observedAt": "2026-09-29"
  },
  "lifecycle": "draft",
  "externalRefs": [
    {
      "system": "legacy-cases-import",
      "id": "ade8a10bd7922765110a68986b0690eb3861f2e5:fixtures/generated/beta8/528a.mjs",
      "url": "https://github.com/redact-secret/redact-secret-benchmarks/blob/ade8a10bd7922765110a68986b0690eb3861f2e5/fixtures/generated/beta8/528a.mjs",
      "note": "suite beta8-528a; group #528a · bitwarden-secrets-manager-access-token; 3 fixtures"
    },
    {
      "system": "redact-secret-benchmarks-issue",
      "id": "redact-secret-benchmarks#528",
      "url": "https://github.com/redact-secret/redact-secret-benchmarks/issues/528",
      "note": "Legacy benchmark issue the suite slice was written for."
    }
  ],
  "notes": "Project-authored by the Redact Secret project, which maintains this repository; not independent evidence. Imported as a draft from the legacy suite \"Beta.12 evidence for the Bitwarden Secrets Manager access token (#528, slice a)\" (beta8-528a); not yet reviewed."
}
