{
  "schemaVersion": 1,
  "kind": "case",
  "id": "beta8-213a-npm-token-control-prose",
  "title": "npm Granular access token: benign prose controls",
  "summary": "1 input holding prose or log lines that mention the credential type without a credential.",
  "rationale": "Text about credentials (rotation notices, error messages) is common and contains none. It tests whether the surrounding words alone decide the outcome.",
  "caseTypes": [
    "benign"
  ],
  "families": [
    {
      "family": "npm:granular-access-token",
      "role": "lookalike"
    }
  ],
  "scenarios": [
    "benign-controls-and-twins",
    "regression-behavior"
  ],
  "expectation": {
    "outcome": "must-not-flag",
    "basis": "project-policy",
    "rationale": "Placeholder, reference, template, mask, documentation or ordinary text. Expected silence is project policy.",
    "sources": [
      {
        "sourceId": "github-blog-802244c4fa",
        "supports": "Cited by the legacy assessment (provider documentation); claim not itemised."
      },
      {
        "sourceId": "github-com-gitleaks-gitleaks-e50f42b821",
        "supports": "Cited by the legacy assessment (open-source scanner rule); claim not itemised."
      },
      {
        "sourceId": "github-com-trufflesecurity-trufflehog-459506d849",
        "supports": "Cited by the legacy assessment (open-source scanner rule); claim not itemised."
      }
    ],
    "observedAt": "2026-09-29"
  },
  "lifecycle": "draft",
  "externalRefs": [
    {
      "system": "legacy-cases-import",
      "id": "ade8a10bd7922765110a68986b0690eb3861f2e5:fixtures/generated/beta8/213a.mjs",
      "url": "https://github.com/redact-secret/redact-secret-benchmarks/blob/ade8a10bd7922765110a68986b0690eb3861f2e5/fixtures/generated/beta8/213a.mjs",
      "note": "suite beta8-213a; group #213a · npm-token; 1 fixture"
    },
    {
      "system": "redact-secret-benchmarks-issue",
      "id": "redact-secret-benchmarks#213",
      "url": "https://github.com/redact-secret/redact-secret-benchmarks/issues/213",
      "note": "Legacy benchmark issue the suite slice was written for."
    }
  ],
  "notes": "Project-authored by the Redact Secret project, which maintains this repository; not independent evidence. Imported as a draft from the legacy suite \"Beta.8 legacy-stable profile restoration (#213, set a)\" (beta8-213a); not yet reviewed."
}
