{
  "schemaVersion": 1,
  "kind": "case",
  "id": "beta8-434a-doppler-personal-token-twin-boundary",
  "title": "Doppler Personal token (dp.pt.): one-property twin (boundary)",
  "summary": "5 inputs are identical to a positive input except for one change: the value is cut, extended or delimited so that it no longer ends where the format ends. Legacy mutation notes: boundary: _ glued before dp, boundary: _x glued after the body, so the token is embedded in a longer identifier, and boundary: an identifier byte glued before dp, and 2 more. Twin of \"Doppler Personal token (dp.pt.): must be flagged\".",
  "rationale": "A twin changes exactly one property, so the expected outcome differs from the positive for that one reason. Reporting the twin is a false alarm, and it shows that the changed property is part of what identifies the credential.",
  "caseTypes": [
    "twin",
    "mutation",
    "benign"
  ],
  "families": [
    {
      "family": "doppler:personal-token",
      "role": "lookalike"
    }
  ],
  "scenarios": [
    "benign-controls-and-twins",
    "context-and-encoding",
    "regression-behavior"
  ],
  "expectation": {
    "outcome": "must-not-flag",
    "basis": "tool-corroborated",
    "rationale": "Negative twin of doppler-personal-token-bare-prose: boundary: an identifier byte glued before dp. Exactly one structural property differs from the positive; silence follows from construction.",
    "sources": [
      {
        "sourceId": "docs-doppler-com-7a28d9952f",
        "supports": "Cited by the legacy assessment (provider documentation); claim not itemised."
      },
      {
        "sourceId": "docs-github-com-14499c804f",
        "supports": "Cited by the legacy assessment (provider documentation); claim not itemised."
      },
      {
        "sourceId": "github-com-gitleaks-gitleaks-e50f42b821",
        "supports": "Cited by the legacy assessment (open-source scanner rule); claim not itemised."
      },
      {
        "sourceId": "github-com-redact-secret-redact-secret-49dcd8ebec",
        "supports": "Cited by the legacy assessment (provider documentation); claim not itemised."
      },
      {
        "sourceId": "github-com-redact-secret-redact-secret-600e29e0fd",
        "supports": "Cited by the legacy assessment (project research note); claim not itemised."
      },
      {
        "sourceId": "github-com-redact-secret-redact-secret-962d6eb235",
        "supports": "Cited by the legacy assessment (issue or discussion); claim not itemised."
      },
      {
        "sourceId": "github-com-redact-secret-redact-secret-ac559a3b98",
        "supports": "Cited by the legacy assessment (provider documentation); claim not itemised."
      },
      {
        "sourceId": "github-com-redact-secret-redact-secret-benchmarks-fb496527b7",
        "supports": "Cited by the legacy assessment (issue or discussion); claim not itemised."
      },
      {
        "sourceId": "github-com-trufflesecurity-trufflehog-68f0f6d2ec",
        "supports": "Cited by the legacy assessment (open-source scanner rule); claim not itemised."
      }
    ],
    "observedAt": "2026-09-29"
  },
  "relations": [
    {
      "type": "twin-of",
      "target": "beta8-434a-doppler-personal-token",
      "mutationKind": "boundary",
      "note": "boundary: the . after dp removed"
    }
  ],
  "lifecycle": "draft",
  "externalRefs": [
    {
      "system": "legacy-cases-import",
      "id": "ade8a10bd7922765110a68986b0690eb3861f2e5:fixtures/generated/beta8/434a.mjs",
      "url": "https://github.com/redact-secret/redact-secret-benchmarks/blob/ade8a10bd7922765110a68986b0690eb3861f2e5/fixtures/generated/beta8/434a.mjs",
      "note": "suite beta8-434a; group #434a · doppler-personal-token; 5 fixtures"
    },
    {
      "system": "redact-secret-benchmarks-issue",
      "id": "redact-secret-benchmarks#434",
      "url": "https://github.com/redact-secret/redact-secret-benchmarks/issues/434",
      "note": "Legacy benchmark issue the suite slice was written for."
    }
  ],
  "notes": "Project-authored by the Redact Secret project, which maintains this repository; not independent evidence. Imported as a draft from the legacy suite \"Beta.11 evidence for Doppler tokens (#434, slice a)\" (beta8-434a); not yet reviewed."
}
