{
  "schemaVersion": 1,
  "kind": "case",
  "id": "beta8-434e-helicone-write-api-key-control-near-miss",
  "title": "Write-only key (pk-helicone-): benign near miss controls",
  "summary": "2 inputs holding near-miss values that resemble the format but break it (truncated, wrong separator, wrong prefix or too short).",
  "rationale": "Incomplete or malformed values are not issued credentials. They test whether the format's structure, and not only its look, is what identifies a credential.",
  "caseTypes": [
    "benign"
  ],
  "families": [
    {
      "family": "helicone:write-api-key",
      "role": "lookalike"
    }
  ],
  "scenarios": [
    "benign-controls-and-twins",
    "regression-behavior"
  ],
  "expectation": {
    "outcome": "must-not-flag",
    "basis": "tool-corroborated",
    "rationale": "Malformed-by-construction control: prefix-only, truncated, mis-delimited or public-material shape of a contracted family. Expected silence follows from construction.",
    "sources": [
      {
        "sourceId": "docs-helicone-ai-d38ccdd2b1",
        "supports": "Cited by the legacy assessment (provider documentation); claim not itemised."
      },
      {
        "sourceId": "github-com-helicone-helicone-5c6d36b08a",
        "supports": "Cited by the legacy assessment (provider SDK source); claim not itemised."
      },
      {
        "sourceId": "github-com-helicone-helicone-5d52038da4",
        "supports": "Cited by the legacy assessment (source); claim not itemised."
      },
      {
        "sourceId": "github-com-helicone-helicone-92ae12e8a4",
        "supports": "Cited by the legacy assessment (provider documentation); claim not itemised."
      },
      {
        "sourceId": "github-com-helicone-helicone-f8ce889eaf",
        "supports": "Cited by the legacy assessment (provider SDK source); claim not itemised."
      },
      {
        "sourceId": "github-com-redact-secret-redact-secret-600e29e0fd",
        "supports": "Cited by the legacy assessment (project research note); claim not itemised."
      },
      {
        "sourceId": "github-com-redact-secret-redact-secret-8f9e36f7ba",
        "supports": "Cited by the legacy assessment (issue or discussion); claim not itemised."
      },
      {
        "sourceId": "github-com-redact-secret-redact-secret-ac559a3b98",
        "supports": "Cited by the legacy assessment (provider documentation); claim not itemised.",
        "locator": "#issuecomment-5852413851"
      },
      {
        "sourceId": "github-com-redact-secret-redact-secret-ac559a3b98",
        "supports": "Cited by the legacy assessment (provider documentation); claim not itemised.",
        "locator": "#issuecomment-5871306275"
      },
      {
        "sourceId": "github-com-redact-secret-redact-secret-ac559a3b98",
        "supports": "Cited by the legacy assessment (provider documentation); claim not itemised."
      },
      {
        "sourceId": "github-com-redact-secret-redact-secret-benchmarks-fb496527b7",
        "supports": "Cited by the legacy assessment (issue or discussion); claim not itemised."
      },
      {
        "sourceId": "github-com-redact-secret-redact-secret-e1d926e2d6",
        "supports": "Cited by the legacy assessment (provider documentation); claim not itemised."
      }
    ],
    "observedAt": "2026-09-29"
  },
  "lifecycle": "draft",
  "externalRefs": [
    {
      "system": "legacy-cases-import",
      "id": "ade8a10bd7922765110a68986b0690eb3861f2e5:fixtures/generated/beta8/434e.mjs",
      "url": "https://github.com/redact-secret/redact-secret-benchmarks/blob/ade8a10bd7922765110a68986b0690eb3861f2e5/fixtures/generated/beta8/434e.mjs",
      "note": "suite beta8-434e; group #434e · helicone-write-api-key; 2 fixtures"
    },
    {
      "system": "redact-secret-benchmarks-issue",
      "id": "redact-secret-benchmarks#434",
      "url": "https://github.com/redact-secret/redact-secret-benchmarks/issues/434",
      "note": "Legacy benchmark issue the suite slice was written for."
    }
  ],
  "notes": "Project-authored by the Redact Secret project, which maintains this repository; not independent evidence. Imported as a draft from the legacy suite \"Beta.11 evidence for the Helicone read-write and write-only keys (#434, slice e)\" (beta8-434e); not yet reviewed."
}
