{
  "schemaVersion": 1,
  "kind": "case",
  "id": "beta8-212-pinecone-api-key-legacy-control-near-miss",
  "title": "Pinecone Legacy API key (bare UUID): benign near miss controls",
  "summary": "4 inputs holding near-miss values that resemble the format but break it (truncated, wrong separator, wrong prefix or too short).",
  "rationale": "Incomplete or malformed values are not issued credentials. They test whether the format's structure, and not only its look, is what identifies a credential.",
  "caseTypes": [
    "benign"
  ],
  "families": [
    {
      "family": "pinecone:legacy-api-key",
      "role": "lookalike"
    }
  ],
  "scenarios": [
    "benign-controls-and-twins",
    "regression-behavior"
  ],
  "expectation": {
    "outcome": "must-not-flag",
    "basis": "project-policy",
    "rationale": "Legacy tier T2 (tool-corroborated), but the cited sources do not include artifacts from two distinct owners, so the corroboration rule of docs/governance/evidence-classes.md is not met; the legacy expectation is recorded as project-policy pending review. Malformed-by-construction control: prefix-only, truncated, mis-delimited or public-material shape of a contracted family. Expected silence follows from construction.",
    "sources": [],
    "observedAt": "2026-09-29"
  },
  "lifecycle": "draft",
  "externalRefs": [
    {
      "system": "legacy-cases-import",
      "id": "ade8a10bd7922765110a68986b0690eb3861f2e5:fixtures/generated/beta8/212.mjs",
      "url": "https://github.com/redact-secret/redact-secret-benchmarks/blob/ade8a10bd7922765110a68986b0690eb3861f2e5/fixtures/generated/beta8/212.mjs",
      "note": "suite beta8-212; group #212 · pinecone-api-key-legacy; 4 fixtures"
    },
    {
      "system": "redact-secret-benchmarks-issue",
      "id": "redact-secret-benchmarks#212",
      "url": "https://github.com/redact-secret/redact-secret-benchmarks/issues/212",
      "note": "Legacy benchmark issue the suite slice was written for."
    }
  ],
  "notes": "Project-authored by the Redact Secret project, which maintains this repository; not independent evidence. Imported as a draft from the legacy suite \"Beta.8 second-wave arrival evidence (#212)\" (beta8-212); not yet reviewed."
}
