{
  "schemaVersion": 1,
  "kind": "case",
  "id": "sendgrid-regressions-structured-text-twin-length",
  "title": "SendGrid key in JSON and quoted environment values: one-property twin (length)",
  "summary": "2 inputs are identical to a positive input except for one change: the value's length differs from the contracted length. Legacy mutation notes: length: 42 vs contracted 43. Twin of \"SendGrid key in JSON and quoted environment values: must be flagged\".",
  "rationale": "A twin changes exactly one property, so the expected outcome differs from the positive for that one reason. Reporting the twin is a false alarm, and it shows that the changed property is part of what identifies the credential.",
  "caseTypes": [
    "twin",
    "mutation",
    "benign"
  ],
  "families": [
    {
      "family": "sendgrid:api-key",
      "role": "lookalike"
    }
  ],
  "scenarios": [
    "benign-controls-and-twins",
    "partial-span-leakage",
    "regression-behavior"
  ],
  "expectation": {
    "outcome": "must-not-flag",
    "basis": "tool-corroborated",
    "rationale": "Negative twin of base62-json: length: 42 vs contracted 43. Exactly one structural property differs from the positive; silence follows from construction.",
    "sources": [
      {
        "sourceId": "github-com-gitleaks-gitleaks-e50f42b821",
        "supports": "Cited by the legacy assessment (open-source scanner rule); claim not itemised."
      },
      {
        "sourceId": "github-com-trufflesecurity-trufflehog-f377f65c30",
        "supports": "Cited by the legacy assessment (open-source scanner rule); claim not itemised."
      },
      {
        "sourceId": "support-sendgrid-com-135e975bd1",
        "supports": "Cited by the legacy assessment (provider documentation); claim not itemised."
      }
    ],
    "observedAt": "2026-09-29"
  },
  "relations": [
    {
      "type": "twin-of",
      "target": "sendgrid-regressions-structured-text",
      "mutationKind": "length",
      "note": "length: 42 vs contracted 43"
    }
  ],
  "lifecycle": "draft",
  "externalRefs": [
    {
      "system": "legacy-cases-import",
      "id": "ade8a10bd7922765110a68986b0690eb3861f2e5:fixtures/generated/regressions.mjs",
      "url": "https://github.com/redact-secret/redact-secret-benchmarks/blob/ade8a10bd7922765110a68986b0690eb3861f2e5/fixtures/generated/regressions.mjs",
      "note": "suite sendgrid-regressions; group Structured text; 2 fixtures"
    }
  ],
  "notes": "Project-authored by the Redact Secret project, which maintains this repository; not independent evidence. Imported as a draft from the legacy suite \"SendGrid regressions\" (sendgrid-regressions); not yet reviewed."
}
