{
  "schemaVersion": 1,
  "kind": "case",
  "id": "beta8-384a-anthropic-admin01-key-control-prose",
  "title": "Anthropic Admin API key (sk-ant-admin01-): benign prose controls (project-policy) [legacy tier T3]",
  "summary": "1 input holding prose or log lines that mention the credential type without a credential.",
  "rationale": "Text about credentials (rotation notices, error messages) is common and contains none. It tests whether the surrounding words alone decide the outcome.",
  "caseTypes": [
    "benign"
  ],
  "families": [
    {
      "family": "anthropic:admin-api-key",
      "role": "lookalike"
    }
  ],
  "scenarios": [
    "benign-controls-and-twins",
    "regression-behavior"
  ],
  "expectation": {
    "outcome": "must-not-flag",
    "basis": "project-policy",
    "rationale": "Placeholder, reference, template, mask, documentation or ordinary text. Expected silence is project policy.",
    "sources": [
      {
        "sourceId": "docs-github-com-14499c804f",
        "supports": "Cited by the legacy assessment (provider documentation); claim not itemised."
      },
      {
        "sourceId": "github-com-betterleaks-betterleaks-97636ec847",
        "supports": "Cited by the legacy assessment (open-source scanner rule); claim not itemised."
      },
      {
        "sourceId": "github-com-gitleaks-gitleaks-e50f42b821",
        "supports": "Cited by the legacy assessment (open-source scanner rule); claim not itemised."
      },
      {
        "sourceId": "github-com-redact-secret-redact-secret-2d3dfe0d77",
        "supports": "Cited by the legacy assessment (issue or discussion); claim not itemised."
      },
      {
        "sourceId": "github-com-redact-secret-redact-secret-33dc3121b8",
        "supports": "Cited by the legacy assessment (issue or discussion); claim not itemised."
      },
      {
        "sourceId": "github-com-trufflesecurity-trufflehog-8af9b5cf8a",
        "supports": "Cited by the legacy assessment (issue or discussion); claim not itemised."
      },
      {
        "sourceId": "github-com-trufflesecurity-trufflehog-a754062613",
        "supports": "Cited by the legacy assessment (open-source scanner rule); claim not itemised."
      },
      {
        "sourceId": "platform-claude-com-864b183d97",
        "supports": "Cited by the legacy assessment (provider documentation); claim not itemised."
      },
      {
        "sourceId": "platform-claude-com-b68cbf8cc4",
        "supports": "Cited by the legacy assessment (provider documentation); claim not itemised."
      },
      {
        "sourceId": "platform-claude-com-c9def02fc9",
        "supports": "Cited by the legacy assessment (provider documentation); claim not itemised."
      }
    ],
    "observedAt": "2026-09-29"
  },
  "lifecycle": "draft",
  "externalRefs": [
    {
      "system": "legacy-cases-import",
      "id": "ade8a10bd7922765110a68986b0690eb3861f2e5:fixtures/generated/beta8/384a.mjs",
      "url": "https://github.com/redact-secret/redact-secret-benchmarks/blob/ade8a10bd7922765110a68986b0690eb3861f2e5/fixtures/generated/beta8/384a.mjs",
      "note": "suite beta8-384a; group #384a · anthropic-admin01-key; 1 fixture"
    },
    {
      "system": "redact-secret-benchmarks-issue",
      "id": "redact-secret-benchmarks#384",
      "url": "https://github.com/redact-secret/redact-secret-benchmarks/issues/384",
      "note": "Legacy benchmark issue the suite slice was written for."
    }
  ],
  "notes": "Project-authored by the Redact Secret project, which maintains this repository; not independent evidence. Imported as a draft from the legacy suite \"Beta.10 evidence for the Anthropic api01/admin01 prefixes and the OpenAI admin key (#384, slice a)\" (beta8-384a); not yet reviewed."
}
